stim1,stim2,stim3
551,她们或多或少促进了就业。,+
552,她们或多或少没促进就业。,-
553,他们或多或少监察了资产素质情况。,+
554,他们或多或少没监察资产素质情况。,-
555,他们或多或少恭贺了圣诞。,+
556,他们或多或少没恭贺圣诞。,-
557,他们或多或少兴建了大型火力发电厂。,+
558,他们或多或少没兴建大型火力发电厂。,-
559,他们或多或少申请了登记证。,+
560,他们或多或少没申请登记证。,-
561,她们或多或少任职了主管。,+
562,她们或多或少没任职主管。,-
563,她们或多或少带入了世界先进行列。,+
564,她们或多或少没带入世界先进行列。,-
565,她们或多或少返回了祖国。,+
566,她们或多或少没返回祖国。,-
567,她们或多或少安度了中年。,+
568,她们或多或少没安度中年。,-
569,他们或多或少翻译成了进化轮。,+
570,他们或多或少没翻译成进化轮。,-
571,他们或多或少送去了托儿所。,+
572,他们或多或少没送去托儿所。,-
573,他们或多或少遍植了毒草。,+
574,他们或多或少没遍植毒草。,-
575,她们或多或少抗击了日寇。,+
576,她们或多或少没抗击日寇。,-
577,她们或多或少交流了意见。,+
578,她们或多或少没交流意见。,-
579,她们或多或少耗尽了积蓄。,+
580,她们或多或少没耗尽积蓄。,-
581,他们或多或少品尝了佳肴。,+
582,他们或多或少没品尝佳肴。,-
583,她们或多或少绕了其轴心。,+
584,她们或多或少没绕其轴心。,-
585,她们或多或少xian-了逻辑。,+
586,她们或多或少没xian-逻辑。,-
587,她们或多或少接受了审问。,+
588,她们或多或少没接受审问。,-
589,她们或多或少带回了警局。,+
590,她们或多或少没带回警局。,-
591,她们或多或少砸断了犯罪链条。,+
592,她们或多或少没砸断犯罪链条。,-
593,她们或多或少加盟了个酒店。,+
594,她们或多或少没加盟个酒店。,-
595,他们或多或少恢复了真象。,+
596,他们或多或少没恢复真象。,-
597,她们或多或少打击了周边小国。,+
598,她们或多或少没打击周边小国。,-
599,他们或多或少发自了感情。,+
600,他们或多或少没发自感情。,-
601,她们或多或少拍摄了广告片。,+
602,她们或多或少没拍摄广告片。,-
603,她们或多或少吃掉了穷人一年粮。,+
604,她们或多或少没吃掉穷人一年粮。,-
605,他们或多或少用了本国车。,+
606,他们或多或少没用本国车。,-
607,他们或多或少建立了手册管理。,+
608,他们或多或少没建立手册管理。,-
609,他们或多或少进行了发表。,+
610,他们或多或少没进行发表。,-
611,他们或多或少找了市长政府。,+
612,他们或多或少没找市长政府。,-
613,她们或多或少收回了全部岛屿。,+
614,她们或多或少没收回全部岛屿。,-
615,他们或多或少驱逐了鞑虏。,+
616,他们或多或少没驱逐鞑虏。,-
617,她们或多或少提供了劳动保护。,+
618,她们或多或少没提供劳动保护。,-
619,他们或多或少裁撤了４０００个职位。,+
620,他们或多或少没裁撤４０００个职位。,-
621,她们或多或少给予了指导。,+
622,她们或多或少没给予指导。,-
623,她们或多或少寻求了平衡。,+
624,她们或多或少没寻求平衡。,-
625,她们或多或少充当了绝密消息来源。,+
626,她们或多或少没充当绝密消息来源。,-
627,她们或多或少注重了政绩。,+
628,她们或多或少没注重政绩。,-
629,他们或多或少处理了信息。,+
630,他们或多或少没处理信息。,-
631,他们或多或少视了市场情况。,+
632,他们或多或少没视市场情况。,-
633,他们或多或少展望了未来。,+
634,他们或多或少没展望未来。,-
635,他们或多或少参与了联合国维和任务。,+
636,他们或多或少没参与联合国维和任务。,-
637,他们或多或少需了食物暖气或毯子。,+
638,他们或多或少没需食物暖气或毯子。,-
639,她们或多或少推动了我国经济发展。,+
640,她们或多或少没推动我国经济发展。,-
641,他们或多或少充当了叛徒和内奸。,+
642,他们或多或少没充当叛徒和内奸。,-
643,他们或多或少进行了报告。,+
644,他们或多或少没进行报告。,-
645,他们或多或少考虑了将来。,+
646,他们或多或少没考虑将来。,-
647,他们或多或少达了６９种之多。,+
648,他们或多或少没达６９种之多。,-
649,他们或多或少配合了反政府武装。,+
650,他们或多或少没配合反政府武装。,-
651,她们或多或少感谢了我们。,+
652,她们或多或少没感谢我们。,-
653,她们或多或少结成了联盟。,+
654,她们或多或少没结成联盟。,-
655,他们或多或少酷似了大陆小孩。,+
656,他们或多或少没酷似大陆小孩。,-
657,她们或多或少克服了金融危机。,+
658,她们或多或少没克服金融危机。,-
659,她们或多或少耗费了体力。,+
660,她们或多或少没耗费体力。,-
661,他们或多或少接触了原住民。,+
662,他们或多或少没接触原住民。,-
663,他们或多或少发表了演讲。,+
664,他们或多或少没发表演讲。,-
665,她们或多或少赶回了家里。,+
666,她们或多或少没赶回家里。,-
667,他们或多或少自称了大姐。,+
668,他们或多或少没自称大姐。,-
669,她们或多或少使用了液化气。,+
670,她们或多或少没使用液化气。,-
671,他们或多或少重建了建筑。,+
672,他们或多或少没重建建筑。,-
673,他们或多或少没收了手推车。,+
674,他们或多或少没没收手推车。,-
675,他们或多或少武装了我们百姓。,+
676,他们或多或少没武装我们百姓。,-
677,他们或多或少奉献给了用户。,+
678,他们或多或少没奉献给用户。,-
679,她们或多或少投资了国家基础建设。,+
680,她们或多或少没投资国家基础建设。,-
681,他们或多或少买了15000人民币。,+
682,他们或多或少没买15000人民币。,-
683,他们或多或少经营了增值电信。,+
684,他们或多或少没经营增值电信。,-
685,他们或多或少缩小了贫富差距。,+
686,他们或多或少没缩小贫富差距。,-
687,她们或多或少设了停车场。,+
688,她们或多或少没设停车场。,-
689,她们或多或少引起了注意。,+
690,她们或多或少没引起注意。,-
691,她们或多或少结束了审判。,+
692,她们或多或少没结束审判。,-
693,他们或多或少比起了美国公司。,+
694,他们或多或少没比起美国公司。,-
695,他们或多或少产了乙烯三十万吨。,+
696,他们或多或少没产乙烯三十万吨。,-
697,他们或多或少放开了手脚。,+
698,他们或多或少没放开手脚。,-
699,他们或多或少当了个工人。,+
700,他们或多或少没当个工人。,-
701,他们或多或少提升了都市形象。,+
702,他们或多或少没提升都市形象。,-
703,她们或多或少调整了日期。,+
704,她们或多或少没调整日期。,-
705,她们或多或少实施了长江开发开放。,+
706,她们或多或少没实施长江开发开放。,-
707,她们或多或少带上了法庭。,+
708,她们或多或少没带上法庭。,-
709,她们或多或少去了海洋世界。,+
710,她们或多或少没去海洋世界。,-
711,他们或多或少悠游了其中。,+
712,他们或多或少没悠游其中。,-
713,他们或多或少报导了雏妓爱滋病患。,+
714,他们或多或少没报导雏妓爱滋病患。,-
715,他们或多或少击落了飞机和导弹。,+
716,他们或多或少没击落飞机和导弹。,-
717,他们或多或少增强了马六甲海峡军力。,+
718,他们或多或少没增强马六甲海峡军力。,-
719,她们或多或少宣布了停办。,+
720,她们或多或少没宣布停办。,-
721,她们或多或少找了个park。,+
722,她们或多或少没找个park。,-
723,他们或多或少控告了日本右翼人士。,+
724,他们或多或少没控告日本右翼人士。,-
725,她们或多或少震惊了世界。,+
726,她们或多或少没震惊世界。,-
727,他们或多或少裸露至了腰。,+
728,他们或多或少没裸露至腰。,-
729,他们或多或少考虑了国情。,+
730,他们或多或少没考虑国情。,-
731,他们或多或少驾驭了复杂局势。,+
732,他们或多或少没驾驭复杂局势。,-
733,她们或多或少振兴了产业。,+
734,她们或多或少没振兴产业。,-
735,他们或多或少做了小生意。,+
736,他们或多或少没做小生意。,-
737,他们或多或少保卫了乡土。,+
738,他们或多或少没保卫乡土。,-
739,他们或多或少印制了拷贝数。,+
740,他们或多或少没印制拷贝数。,-
741,她们或多或少播报了新闻现场。,+
742,她们或多或少没播报新闻现场。,-
743,她们或多或少问了实际成效。,+
744,她们或多或少没问实际成效。,-
745,她们或多或少赚取了第一桶金。,+
746,她们或多或少没赚取第一桶金。,-
747,她们或多或少兴建了供水与排水系统。,+
748,她们或多或少没兴建供水与排水系统。,-
749,她们或多或少发挥了定位功能。,+
750,她们或多或少没发挥定位功能。,-
751,他们或多或少介绍了原住民纺织术。,+
752,他们或多或少没介绍原住民纺织术。,-
753,她们或多或少组建了一个临时政府。,+
754,她们或多或少没组建一个临时政府。,-
755,他们或多或少构建了和谐社会。,+
756,他们或多或少没构建和谐社会。,-
757,她们或多或少违反了选罢法。,+
758,她们或多或少没违反选罢法。,-
759,她们或多或少达了十五个国家和地区。,+
760,她们或多或少没达十五个国家和地区。,-
761,她们或多或少启动了城镇住房消费。,+
762,她们或多或少没启动城镇住房消费。,-
763,她们或多或少违背了我们决定。,+
764,她们或多或少没违背我们决定。,-
765,她们或多或少进入了八强。,+
766,她们或多或少没进入八强。,-
767,她们或多或少接了我和你。,+
768,她们或多或少没接我和你。,-
769,他们或多或少算了一个政治老账。,+
770,他们或多或少没算一个政治老账。,-
771,她们或多或少实行了全面遏制。,+
772,她们或多或少没实行全面遏制。,-
773,他们或多或少寻找了新闻乌托邦。,+
774,他们或多或少没寻找新闻乌托邦。,-
775,他们或多或少兑换成了欧元。,+
776,他们或多或少没兑换成欧元。,-
777,他们或多或少影响了稳定。,+
778,他们或多或少没影响稳定。,-
779,他们或多或少符合了欧盟自身利益。,+
780,他们或多或少没符合欧盟自身利益。,-
781,他们或多或少对照了今昔。,+
782,他们或多或少没对照今昔。,-
783,他们或多或少进行了两岸政治对话。,+
784,他们或多或少没进行两岸政治对话。,-
785,他们或多或少遭受了巨大损失。,+
786,他们或多或少没遭受巨大损失。,-
787,他们或多或少由了汝书生。,+
788,他们或多或少没由汝书生。,-
789,她们或多或少享了亲情之乐。,+
790,她们或多或少没享亲情之乐。,-
791,他们或多或少做了小本生意。,+
792,他们或多或少没做小本生意。,-
793,他们或多或少进行了试验。,+
794,他们或多或少没进行试验。,-
795,她们或多或少造福了自我。,+
796,她们或多或少没造福自我。,-
797,她们或多或少卖了域名。,+
798,她们或多或少没卖域名。,-
799,她们或多或少当了人体模特。,+
800,她们或多或少没当人体模特。,-
801,他们或多或少换来了人心。,+
802,他们或多或少没换来人心。,-
803,他们或多或少设置了教育培训内容。,+
804,他们或多或少没设置教育培训内容。,-
805,他们或多或少改善了生活质量。,+
806,他们或多或少没改善生活质量。,-
807,他们或多或少安装了专用控制器软件。,+
808,他们或多或少没安装专用控制器软件。,-
809,她们或多或少乘了直升机。,+
810,她们或多或少没乘直升机。,-
811,她们或多或少进行了报复。,+
812,她们或多或少没进行报复。,-
813,他们或多或少掉入了大海。,+
814,他们或多或少没掉入大海。,-
815,他们或多或少控制了空中。,+
816,他们或多或少没控制空中。,-
817,他们或多或少整理了2012版本。,+
818,他们或多或少没整理2012版本。,-
819,她们或多或少增加了进气量。,+
820,她们或多或少没增加进气量。,-
821,她们或多或少告诉了你东西。,+
822,她们或多或少没告诉你东西。,-
823,她们或多或少投资了五亿多元人民币。,+
824,她们或多或少没投资五亿多元人民币。,-
825,他们或多或少对待了此事。,+
826,他们或多或少没对待此事。,-
827,她们或多或少发表了主席声明。,+
828,她们或多或少没发表主席声明。,-
829,她们或多或少欣赏了明星。,+
830,她们或多或少没欣赏明星。,-
831,她们或多或少发行了债券。,+
832,她们或多或少没发行债券。,-
833,她们或多或少使用了西医疗法。,+
834,她们或多或少没使用西医疗法。,-
835,他们或多或少开发了早期警告系统。,+
836,他们或多或少没开发早期警告系统。,-
837,她们或多或少参与了竞标。,+
838,她们或多或少没参与竞标。,-
839,他们或多或少进行了调查和处理。,+
840,他们或多或少没进行调查和处理。,-
841,他们或多或少干了文字活。,+
842,他们或多或少没干文字活。,-
843,她们或多或少投资了亚洲国家。,+
844,她们或多或少没投资亚洲国家。,-
845,他们或多或少执行了国家强制性规范。,+
846,他们或多或少没执行国家强制性规范。,-
847,他们或多或少搞了衣服和包包。,+
848,他们或多或少没搞衣服和包包。,-
849,他们或多或少进行了自学。,+
850,他们或多或少没进行自学。,-
851,他们或多或少存放了烟火爆竹。,+
852,他们或多或少没存放烟火爆竹。,-
853,她们或多或少加以了伸缩挪让。,+
854,她们或多或少没加以伸缩挪让。,-
855,他们或多或少登陆了服务器。,+
856,他们或多或少没登陆服务器。,-
857,他们或多或少制造了核弹。,+
858,他们或多或少没制造核弹。,-
859,她们或多或少破坏了六方会谈。,+
860,她们或多或少没破坏六方会谈。,-
861,他们或多或少执行了核四预算。,+
862,他们或多或少没执行核四预算。,-
863,他们或多或少位居了前列。,+
864,他们或多或少没位居前列。,-
865,他们或多或少花了很多心思。,+
866,他们或多或少没花很多心思。,-
867,她们或多或少叫了二鬼子。,+
868,她们或多或少没叫二鬼子。,-
869,她们或多或少敬献了花圈。,+
870,她们或多或少没敬献花圈。,-
871,他们或多或少宣传了诚信。,+
872,他们或多或少没宣传诚信。,-
873,她们或多或少组织了活动。,+
874,她们或多或少没组织活动。,-
875,她们或多或少展开了竞赛。,+
876,她们或多或少没展开竞赛。,-
877,她们或多或少踩了固定式脚踏车。,+
878,她们或多或少没踩固定式脚踏车。,-
879,她们或多或少予以了没收。,+
880,她们或多或少没予以没收。,-
881,他们或多或少玩了两个地方。,+
882,他们或多或少没玩两个地方。,-
883,她们或多或少等待了最佳时机。,+
884,她们或多或少没等待最佳时机。,-
885,她们或多或少校注了医药方技之书。,+
886,她们或多或少没校注医药方技之书。,-
887,他们或多或少尽了一切可能。,+
888,他们或多或少没尽一切可能。,-
889,她们或多或少看了动画片。,+
890,她们或多或少没看动画片。,-
891,他们或多或少弄了个总统。,+
892,他们或多或少没弄个总统。,-
893,她们或多或少举起了机关枪。,+
894,她们或多或少没举起机关枪。,-
895,他们或多或少传染上了多少细菌。,+
896,他们或多或少没传染上多少细菌。,-
897,他们或多或少扩大了追查。,+
898,他们或多或少没扩大追查。,-
899,她们或多或少筹集了竞选经费。,+
900,她们或多或少没筹集竞选经费。,-
901,她们或多或少参与了起草。,+
902,她们或多或少没参与起草。,-
903,他们或多或少报道了北京中南海。,+
904,他们或多或少没报道北京中南海。,-
905,她们或多或少抓了市场开拓。,+
906,她们或多或少没抓市场开拓。,-
907,她们或多或少残刹了我13名同胞。,+
908,她们或多或少没残刹我13名同胞。,-
909,她们或多或少拖动了推土机。,+
910,她们或多或少没拖动推土机。,-
911,她们或多或少毁灭掉了整个世界。,+
912,她们或多或少没毁灭掉整个世界。,-
913,她们或多或少睡了女人。,+
914,她们或多或少没睡女人。,-
915,他们或多或少算了fulltime。,+
916,他们或多或少没算fulltime。,-
917,她们或多或少发行了股票。,+
918,她们或多或少没发行股票。,-
919,她们或多或少究了其缘由。,+
920,她们或多或少没究其缘由。,-
921,她们或多或少吃了祖宗饭。,+
922,她们或多或少没吃祖宗饭。,-
923,他们或多或少停泊了军舰。,+
924,他们或多或少没停泊军舰。,-
925,他们或多或少pay了钱。,+
926,他们或多或少没pay钱。,-
927,她们或多或少象征了地位与财富。,+
928,她们或多或少没象征地位与财富。,-
929,她们或多或少抢劫了超商。,+
930,她们或多或少没抢劫超商。,-
931,他们或多或少拿了奖学金。,+
932,他们或多或少没拿奖学金。,-
933,他们或多或少放置了诱鼠药。,+
934,他们或多或少没放置诱鼠药。,-
935,她们或多或少开展了基因工程研究。,+
936,她们或多或少没开展基因工程研究。,-
937,她们或多或少加强了美中联系。,+
938,她们或多或少没加强美中联系。,-
939,她们或多或少侵略了它国。,+
940,她们或多或少没侵略它国。,-
941,他们或多或少救起了孩子。,+
942,他们或多或少没救起孩子。,-
943,她们或多或少留了个message。,+
944,她们或多或少没留个message。,-
945,他们或多或少举行了聚会。,+
946,他们或多或少没举行聚会。,-
947,她们或多或少陷入了崩溃。,+
948,她们或多或少没陷入崩溃。,-
949,他们或多或少艳惊了国际。,+
950,他们或多或少没艳惊国际。,-
951,他们或多或少建立起了细胞组培中心。,+
952,他们或多或少没建立起细胞组培中心。,-
953,她们或多或少转移了劳动密集型产业。,+
954,她们或多或少没转移劳动密集型产业。,-
955,他们或多或少袭击了内阁总部。,+
956,他们或多或少没袭击内阁总部。,-
957,她们或多或少承担了费用。,+
958,她们或多或少没承担费用。,-
959,他们或多或少危害了司法公正。,+
960,他们或多或少没危害司法公正。,-
961,她们或多或少尊重了你一些。,+
962,她们或多或少没尊重你一些。,-
963,她们或多或少进行了校对改革。,+
964,她们或多或少没进行校对改革。,-
965,他们或多或少告诉了你们。,+
966,他们或多或少没告诉你们。,-
967,他们或多或少建设了司法调解中心。,+
968,他们或多或少没建设司法调解中心。,-
969,他们或多或少用了卫生纸。,+
970,他们或多或少没用卫生纸。,-
971,她们或多或少滴上了一滴尿。,+
972,她们或多或少没滴上一滴尿。,-
973,她们或多或少适应了经济全球化。,+
974,她们或多或少没适应经济全球化。,-
975,她们或多或少执行了命令。,+
976,她们或多或少没执行命令。,-
977,他们或多或少致电了法院。,+
978,他们或多或少没致电法院。,-
979,她们或多或少选择了健身房。,+
980,她们或多或少没选择健身房。,-
981,他们或多或少适合了公交。,+
982,他们或多或少没适合公交。,-
983,他们或多或少增近了两岸互动。,+
984,他们或多或少没增近两岸互动。,-
985,她们或多或少组建了企业集团。,+
986,她们或多或少没组建企业集团。,-
987,她们或多或少发表了电视讲话。,+
988,她们或多或少没发表电视讲话。,-
989,她们或多或少欺骗了旅客。,+
990,她们或多或少没欺骗旅客。,-
991,她们或多或少拉开了帷幕。,+
992,她们或多或少没拉开帷幕。,-
993,她们或多或少创造了新业绩。,+
994,她们或多或少没创造新业绩。,-
995,他们或多或少进行了开发。,+
996,他们或多或少没进行开发。,-
997,她们或多或少送交了中选会。,+
998,她们或多或少没送交中选会。,-
999,他们或多或少建设了同类电厂。,+
1000,他们或多或少没建设同类电厂。,-
1001,他们或多或少进行了处罚。,+
1002,他们或多或少没进行处罚。,-
1003,她们或多或少带了美女翻译。,+
1004,她们或多或少没带美女翻译。,-
1005,他们或多或少利用了卫星。,+
1006,他们或多或少没利用卫星。,-
1007,她们或多或少攫取了权力。,+
1008,她们或多或少没攫取权力。,-
1009,他们或多或少唱了卡拉OK。,+
1010,他们或多或少没唱卡拉OK。,-
1011,他们或多或少走进了深山。,+
1012,他们或多或少没走进深山。,-
1013,他们或多或少进行了评估。,+
1014,他们或多或少没进行评估。,-
1015,他们或多或少售了假种子。,+
1016,他们或多或少没售假种子。,-
1017,他们或多或少包庇了何氏眼科。,+
1018,他们或多或少没包庇何氏眼科。,-
1019,她们或多或少搞了高科技。,+
1020,她们或多或少没搞高科技。,-
1021,他们或多或少提供了一枚神奇子弹。,+
1022,他们或多或少没提供一枚神奇子弹。,-
1023,他们或多或少走向了赛道。,+
1024,他们或多或少没走向赛道。,-
1025,她们或多或少离开了学术圈。,+
1026,她们或多或少没离开学术圈。,-
1027,他们或多或少失去了联络。,+
1028,他们或多或少没失去联络。,-
1029,她们或多或少给以了只吃。,+
1030,她们或多或少没给以只吃。,-
1031,她们或多或少禁止了售卖。,+
1032,她们或多或少没禁止售卖。,-
1033,她们或多或少开了顾问公司。,+
1034,她们或多或少没开顾问公司。,-
1035,他们或多或少反观了我们。,+
1036,他们或多或少没反观我们。,-
1037,他们或多或少建立了社会保障体系。,+
1038,他们或多或少没建立社会保障体系。,-
1039,他们或多或少拉起了布条。,+
1040,他们或多或少没拉起布条。,-
1041,她们或多或少发起了军事行动。,+
1042,她们或多或少没发起军事行动。,-
1043,他们或多或少养了一缸鱼。,+
1044,他们或多或少没养一缸鱼。,-
1045,他们或多或少做错了方向。,+
1046,他们或多或少没做错方向。,-
1047,她们或多或少进行了买卖。,+
1048,她们或多或少没进行买卖。,-
1049,她们或多或少参加了择校考试。,+
1050,她们或多或少没参加择校考试。,-
1051,她们或多或少负责了社会学研究部分。,+
1052,她们或多或少没负责社会学研究部分。,-
1053,他们或多或少回击了听众。,+
1054,他们或多或少没回击听众。,-
1055,她们或多或少描绘了都会生活。,+
1056,她们或多或少没描绘都会生活。,-
1057,他们或多或少进入了戏剧社。,+
1058,他们或多或少没进入戏剧社。,-
1059,他们或多或少遥控了卫星。,+
1060,他们或多或少没遥控卫星。,-
1061,她们或多或少参与了航天业务。,+
1062,她们或多或少没参与航天业务。,-
1063,她们或多或少制定了条约。,+
1064,她们或多或少没制定条约。,-
1065,她们或多或少发布了一项政令。,+
1066,她们或多或少没发布一项政令。,-
1067,她们或多或少开了言词辩论。,+
1068,她们或多或少没开言词辩论。,-
1069,她们或多或少分解了土壤矿物钾。,+
1070,她们或多或少没分解土壤矿物钾。,-
1071,她们或多或少滥用了私权。,+
1072,她们或多或少没滥用私权。,-
1073,他们或多或少唱了英文歌。,+
1074,他们或多或少没唱英文歌。,-
1075,她们或多或少购买入园了二次套票。,+
1076,她们或多或少没购买入园二次套票。,-
1077,她们或多或少担忧了万年国大。,+
1078,她们或多或少没担忧万年国大。,-
1079,她们或多或少引起了很大反响。,+
1080,她们或多或少没引起很大反响。,-
1081,她们或多或少喝了茅台酒。,+
1082,她们或多或少没喝茅台酒。,-
1083,他们或多或少发了一封信。,+
1084,他们或多或少没发一封信。,-
1085,她们或多或少见了刺绣品。,+
1086,她们或多或少没见刺绣品。,-
1087,她们或多或少站稳了传统媒体市场。,+
1088,她们或多或少没站稳传统媒体市场。,-
1089,他们或多或少处理了中印关系。,+
1090,他们或多或少没处理中印关系。,-
1091,她们或多或少进行了一场辩论。,+
1092,她们或多或少没进行一场辩论。,-
