stim1,stim2,stim3
1093,她们或多或少考虑了对台问题。,+
1094,她们或多或少没考虑对台问题。,-
1095,他们或多或少改善了股市结构。,+
1096,他们或多或少没改善股市结构。,-
1097,她们或多或少缺少了人性。,+
1098,她们或多或少没缺少人性。,-
1099,他们或多或少掀起了高潮。,+
1100,他们或多或少没掀起高潮。,-
1101,他们或多或少询问了其他人。,+
1102,他们或多或少没询问其他人。,-
1103,他们或多或少进行了性犯罪。,+
1104,他们或多或少没进行性犯罪。,-
1105,他们或多或少掌了西汉国家大政。,+
1106,他们或多或少没掌西汉国家大政。,-
1107,她们或多或少感谢了重病。,+
1108,她们或多或少没感谢重病。,-
1109,他们或多或少回归了五四。,+
1110,他们或多或少没回归五四。,-
1111,他们或多或少开设了河西四郡。,+
1112,他们或多或少没开设河西四郡。,-
1113,她们或多或少进入了近200个国家。,+
1114,她们或多或少没进入近200个国家。,-
1115,她们或多或少学了专业知识。,+
1116,她们或多或少没学专业知识。,-
1117,她们或多或少涉及了个人隐私问题。,+
1118,她们或多或少没涉及个人隐私问题。,-
1119,他们或多或少使用了原产地。,+
1120,他们或多或少没使用原产地。,-
1121,他们或多或少遍布了各地。,+
1122,他们或多或少没遍布各地。,-
1123,他们或多或少承包了工程。,+
1124,他们或多或少没承包工程。,-
1125,她们或多或少推翻了金家王朝。,+
1126,她们或多或少没推翻金家王朝。,-
1127,她们或多或少安置了全部职工。,+
1128,她们或多或少没安置全部职工。,-
1129,他们或多或少给了人自由。,+
1130,他们或多或少没给人自由。,-
1131,她们或多或少参加了今天比赛。,+
1132,她们或多或少没参加今天比赛。,-
1133,他们或多或少跑了美国大使馆。,+
1134,他们或多或少没跑美国大使馆。,-
1135,他们或多或少举行了隆重仪式。,+
1136,他们或多或少没举行隆重仪式。,-
1137,他们或多或少蜿蜒了全境。,+
1138,他们或多或少没蜿蜒全境。,-
1139,他们或多或少做了博士后。,+
1140,他们或多或少没做博士后。,-
1141,她们或多或少问了你一个私人问题。,+
1142,她们或多或少没问你一个私人问题。,-
1143,他们或多或少进行了前期筹备。,+
1144,他们或多或少没进行前期筹备。,-
1145,他们或多或少侵略了别人。,+
1146,他们或多或少没侵略别人。,-
1147,她们或多或少提交了进一步信息。,+
1148,她们或多或少没提交进一步信息。,-
1149,她们或多或少调停了大选危机。,+
1150,她们或多或少没调停大选危机。,-
1151,她们或多或少放起了冲天炮或烟花。,+
1152,她们或多或少没放起冲天炮或烟花。,-
1153,他们或多或少具了无厘头。,+
1154,他们或多或少没具无厘头。,-
1155,他们或多或少安排了６课时。,+
1156,他们或多或少没安排６课时。,-
1157,他们或多或少迎来了澳门回归。,+
1158,他们或多或少没迎来澳门回归。,-
1159,他们或多或少打伤了３个人。,+
1160,他们或多或少没打伤３个人。,-
1161,他们或多或少选择了移民。,+
1162,他们或多或少没选择移民。,-
1163,她们或多或少开始了女性教育。,+
1164,她们或多或少没开始女性教育。,-
1165,他们或多或少进行了干预。,+
1166,他们或多或少没进行干预。,-
1167,她们或多或少称了炮群。,+
1168,她们或多或少没称炮群。,-
1169,他们或多或少受了二重罪和苦。,+
1170,他们或多或少没受二重罪和苦。,-
1171,她们或多或少居了领先地位。,+
1172,她们或多或少没居领先地位。,-
1173,她们或多或少提供了保护。,+
1174,她们或多或少没提供保护。,-
1175,他们或多或少帮助了别人。,+
1176,他们或多或少没帮助别人。,-
1177,她们或多或少维护了两国关系稳定。,+
1178,她们或多或少没维护两国关系稳定。,-
1179,他们或多或少改善了农业生产条件。,+
1180,他们或多或少没改善农业生产条件。,-
1181,她们或多或少包括了服务业等。,+
1182,她们或多或少没包括服务业等。,-
1183,她们或多或少处以了罚款。,+
1184,她们或多或少没处以罚款。,-
1185,她们或多或少用了苹果手机。,+
1186,她们或多或少没用苹果手机。,-
1187,他们或多或少传了我空间。,+
1188,他们或多或少没传我空间。,-
1189,她们或多或少提供了补贴。,+
1190,她们或多或少没提供补贴。,-
1191,她们或多或少寻求了安全。,+
1192,她们或多或少没寻求安全。,-
1193,她们或多或少摊开了课本。,+
1194,她们或多或少没摊开课本。,-
1195,她们或多或少放炮震坏了房屋。,+
1196,她们或多或少没放炮震坏房屋。,-
1197,她们或多或少搜索了视频。,+
1198,她们或多或少没搜索视频。,-
1199,他们或多或少建立了半导体封装厂。,+
1200,他们或多或少没建立半导体封装厂。,-
1201,他们或多或少急待了援助。,+
1202,他们或多或少没急待援助。,-
1203,他们或多或少任命了村主任。,+
1204,他们或多或少没任命村主任。,-
1205,她们或多或少直达了港口。,+
1206,她们或多或少没直达港口。,-
1207,她们或多或少组成了促进会。,+
1208,她们或多或少没组成促进会。,-
1209,他们或多或少去了高铁站。,+
1210,他们或多或少没去高铁站。,-
1211,她们或多或少理解了他们。,+
1212,她们或多或少没理解他们。,-
1213,她们或多或少开枪击中了胸部。,+
1214,她们或多或少没开枪击中胸部。,-
1215,她们或多或少突破了规则。,+
1216,她们或多或少没突破规则。,-
1217,她们或多或少明白了我意思。,+
1218,她们或多或少没明白我意思。,-
1219,她们或多或少照顾了老妈。,+
1220,她们或多或少没照顾老妈。,-
1221,他们或多或少吃了些淀粉类食物。,+
1222,他们或多或少没吃些淀粉类食物。,-
1223,他们或多或少跟进了实际情况。,+
1224,他们或多或少没跟进实际情况。,-
1225,他们或多或少洗刷了一些罪名。,+
1226,他们或多或少没洗刷一些罪名。,-
1227,她们或多或少消耗了很长时间和精力。,+
1228,她们或多或少没消耗很长时间和精力。,-
1229,她们或多或少上了fulltime。,+
1230,她们或多或少没上fulltime。,-
1231,她们或多或少进行了娱乐新闻报道。,+
1232,她们或多或少没进行娱乐新闻报道。,-
1233,他们或多或少利用了白天。,+
1234,他们或多或少没利用白天。,-
1235,他们或多或少担任了外贸协会秘书长。,+
1236,他们或多或少没担任外贸协会秘书长。,-
1237,他们或多或少定了一张往返。,+
1238,他们或多或少没定一张往返。,-
1239,他们或多或少停放了５０００辆汽车。,+
1240,他们或多或少没停放５０００辆汽车。,-
1241,她们或多或少学会了英文。,+
1242,她们或多或少没学会英文。,-
1243,他们或多或少发表了简短谈话。,+
1244,他们或多或少没发表简短谈话。,-
1245,她们或多或少修改了法律。,+
1246,她们或多或少没修改法律。,-
1247,她们或多或少针对了个人。,+
1248,她们或多或少没针对个人。,-
1249,他们或多或少玩了高精尖与假大空。,+
1250,他们或多或少没玩高精尖与假大空。,-
1251,他们或多或少拿了美国政坛。,+
1252,他们或多或少没拿美国政坛。,-
1253,她们或多或少保障了自身自由。,+
1254,她们或多或少没保障自身自由。,-
1255,她们或多或少反对了发展。,+
1256,她们或多或少没反对发展。,-
1257,她们或多或少召开了闭门会议。,+
1258,她们或多或少没召开闭门会议。,-
1259,他们或多或少举行了首发式。,+
1260,他们或多或少没举行首发式。,-
1261,他们或多或少请求了特赦。,+
1262,他们或多或少没请求特赦。,-
1263,她们或多或少途经了长流坡水库路段。,+
1264,她们或多或少没途经长流坡水库路段。,-
1265,他们或多或少制造了一点麻烦。,+
1266,他们或多或少没制造一点麻烦。,-
1267,她们或多或少抛弃了一切。,+
1268,她们或多或少没抛弃一切。,-
1269,他们或多或少任了行政院长。,+
1270,他们或多或少没任行政院长。,-
1271,她们或多或少改善了民生。,+
1272,她们或多或少没改善民生。,-
1273,她们或多或少增加了农民负担。,+
1274,她们或多或少没增加农民负担。,-
1275,他们或多或少颁布了新税制。,+
1276,他们或多或少没颁布新税制。,-
1277,她们或多或少实行了无限期宵禁。,+
1278,她们或多或少没实行无限期宵禁。,-
1279,她们或多或少恢复了进行。,+
1280,她们或多或少没恢复进行。,-
1281,她们或多或少发展了两岸关系。,+
1282,她们或多或少没发展两岸关系。,-
1283,他们或多或少创造了世界。,+
1284,他们或多或少没创造世界。,-
1285,他们或多或少实施了军事打击。,+
1286,他们或多或少没实施军事打击。,-
1287,他们或多或少举行了大型造势晚会。,+
1288,他们或多或少没举行大型造势晚会。,-
1289,他们或多或少攒了点儿钱。,+
1290,他们或多或少没攒点儿钱。,-
1291,他们或多或少纪念了五一国际劳动节。,+
1292,他们或多或少没纪念五一国际劳动节。,-
1293,他们或多或少考虑了全社会安定团结。,+
1294,他们或多或少没考虑全社会安定团结。,-
1295,她们或多或少提前了一个月。,+
1296,她们或多或少没提前一个月。,-
1297,她们或多或少生产了半导体。,+
1298,她们或多或少没生产半导体。,-
1299,他们或多或少融入了现代文明。,+
1300,他们或多或少没融入现代文明。,-
1301,他们或多或少建造了天堂。,+
1302,他们或多或少没建造天堂。,-
1303,她们或多或少丰富了人类文化宝库。,+
1304,她们或多或少没丰富人类文化宝库。,-
1305,她们或多或少纳入了刑法规定范围。,+
1306,她们或多或少没纳入刑法规定范围。,-
1307,他们或多或少负责了啥勾当。,+
1308,他们或多或少没负责啥勾当。,-
1309,她们或多或少发挥了所长。,+
1310,她们或多或少没发挥所长。,-
1311,她们或多或少加了点大气。,+
1312,她们或多或少没加点大气。,-
1313,她们或多或少给了孩子一次机会。,+
1314,她们或多或少没给孩子一次机会。,-
1315,他们或多或少申购了经适房。,+
1316,他们或多或少没申购经适房。,-
1317,他们或多或少形成了力量均衡。,+
1318,他们或多或少没形成力量均衡。,-
1319,他们或多或少避免了腐败。,+
1320,他们或多或少没避免腐败。,-
1321,她们或多或少公布了修宪草案。,+
1322,她们或多或少没公布修宪草案。,-
1323,他们或多或少离开了书本。,+
1324,他们或多或少没离开书本。,-
1325,她们或多或少拯救了大兵瑞恩。,+
1326,她们或多或少没拯救大兵瑞恩。,-
1327,他们或多或少当了总统。,+
1328,他们或多或少没当总统。,-
1329,他们或多或少追回了赔款近千万美元。,+
1330,他们或多或少没追回赔款近千万美元。,-
1331,他们或多或少予以了答复。,+
1332,他们或多或少没予以答复。,-
1333,她们或多或少追加了投资。,+
1334,她们或多或少没追加投资。,-
1335,他们或多或少维护了家庭。,+
1336,他们或多或少没维护家庭。,-
1337,他们或多或少回首了往事。,+
1338,他们或多或少没回首往事。,-
1339,她们或多或少缴了400元医保费。,+
1340,她们或多或少没缴400元医保费。,-
1341,他们或多或少推动了南北韩和解。,+
1342,他们或多或少没推动南北韩和解。,-
1343,他们或多或少保证了绿卡。,+
1344,他们或多或少没保证绿卡。,-
1345,他们或多或少去了救助站。,+
1346,他们或多或少没去救助站。,-
1347,他们或多或少进行了会议。,+
1348,他们或多或少没进行会议。,-
1349,她们或多或少处理了油污事件。,+
1350,她们或多或少没处理油污事件。,-
1351,他们或多或少前往了机场。,+
1352,他们或多或少没前往机场。,-
1353,他们或多或少去了苏杭天堂。,+
1354,他们或多或少没去苏杭天堂。,-
1355,他们或多或少建立了企业机制。,+
1356,他们或多或少没建立企业机制。,-
1357,他们或多或少塑造了敌人。,+
1358,他们或多或少没塑造敌人。,-
1359,他们或多或少还了市场以公正。,+
1360,他们或多或少没还市场以公正。,-
1361,她们或多或少选择了前者。,+
1362,她们或多或少没选择前者。,-
1363,他们或多或少暂停了谈判。,+
1364,他们或多或少没暂停谈判。,-
1365,她们或多或少撤离了大陆。,+
1366,她们或多或少没撤离大陆。,-
1367,他们或多或少离开了家园。,+
1368,他们或多或少没离开家园。,-
1369,他们或多或少换取了和平。,+
1370,他们或多或少没换取和平。,-
1371,她们或多或少离开了世界。,+
1372,她们或多或少没离开世界。,-
1373,她们或多或少鼓励了生育。,+
1374,她们或多或少没鼓励生育。,-
1375,她们或多或少加装了涡轮增压器。,+
1376,她们或多或少没加装涡轮增压器。,-
1377,他们或多或少抓住了石灰石。,+
1378,他们或多或少没抓住石灰石。,-
1379,她们或多或少恢复至了合法状态。,+
1380,她们或多或少没恢复至合法状态。,-
1381,她们或多或少赶回了故乡。,+
1382,她们或多或少没赶回故乡。,-
1383,她们或多或少进行了陆上遭遇。,+
1384,她们或多或少没进行陆上遭遇。,-
1385,他们或多或少设立了分行。,+
1386,他们或多或少没设立分行。,-
1387,他们或多或少丢掷了石头。,+
1388,他们或多或少没丢掷石头。,-
1389,她们或多或少交了报税表。,+
1390,她们或多或少没交报税表。,-
1391,他们或多或少投资了观光事业。,+
1392,他们或多或少没投资观光事业。,-
1393,他们或多或少洗刷了冤屈。,+
1394,他们或多或少没洗刷冤屈。,-
1395,他们或多或少给了兔兔妈。,+
1396,他们或多或少没给兔兔妈。,-
1397,她们或多或少贪图了蝇头小利。,+
1398,她们或多或少没贪图蝇头小利。,-
1399,他们或多或少表达了观点。,+
1400,他们或多或少没表达观点。,-
1401,她们或多或少找了个KTV。,+
1402,她们或多或少没找个KTV。,-
1403,她们或多或少培育了成功三代克隆鼠。,+
1404,她们或多或少没培育成功三代克隆鼠。,-
1405,他们或多或少使用了葡文。,+
1406,他们或多或少没使用葡文。,-
1407,她们或多或少进入了税务系统。,+
1408,她们或多或少没进入税务系统。,-
1409,他们或多或少买了工伤保险。,+
1410,他们或多或少没买工伤保险。,-
1411,他们或多或少严惩了领导责任。,+
1412,他们或多或少没严惩领导责任。,-
1413,她们或多或少易受了攻击。,+
1414,她们或多或少没易受攻击。,-
1415,他们或多或少撞击了地球。,+
1416,他们或多或少没撞击地球。,-
1417,她们或多或少排成了单行。,+
1418,她们或多或少没排成单行。,-
1419,他们或多或少抢夺了警枪。,+
1420,他们或多或少没抢夺警枪。,-
1421,她们或多或少助长了色狼。,+
1422,她们或多或少没助长色狼。,-
1423,他们或多或少缺了临门一脚而已。,+
1424,他们或多或少没缺临门一脚而已。,-
1425,她们或多或少修改了联合国宪章。,+
1426,她们或多或少没修改联合国宪章。,-
1427,他们或多或少展现了力量。,+
1428,他们或多或少没展现力量。,-
1429,他们或多或少表了赤子之心。,+
1430,他们或多或少没表赤子之心。,-
1431,她们或多或少稳定了军心。,+
1432,她们或多或少没稳定军心。,-
1433,他们或多或少给了他妈妈。,+
1434,他们或多或少没给他妈妈。,-
1435,她们或多或少固了其根本。,+
1436,她们或多或少没固其根本。,-
1437,他们或多或少提高了升学率。,+
1438,他们或多或少没提高升学率。,-
1439,她们或多或少喜欢了女孩子。,+
1440,她们或多或少没喜欢女孩子。,-
1441,她们或多或少排斥了其它族群。,+
1442,她们或多或少没排斥其它族群。,-
1443,他们或多或少改善了投资条件。,+
1444,他们或多或少没改善投资条件。,-
1445,她们或多或少精简了人事。,+
1446,她们或多或少没精简人事。,-
1447,他们或多或少进行了申办。,+
1448,他们或多或少没进行申办。,-
1449,她们或多或少放眼了全球。,+
1450,她们或多或少没放眼全球。,-
1451,她们或多或少进行了改制重组。,+
1452,她们或多或少没进行改制重组。,-
1453,他们或多或少组成了全国团结政府。,+
1454,他们或多或少没组成全国团结政府。,-
1455,她们或多或少摘取了铜牌。,+
1456,她们或多或少没摘取铜牌。,-
1457,他们或多或少冲进了车站。,+
1458,他们或多或少没冲进车站。,-
1459,他们或多或少享受了终身优遇。,+
1460,他们或多或少没享受终身优遇。,-
1461,她们或多或少投入了人力财力。,+
1462,她们或多或少没投入人力财力。,-
1463,她们或多或少举办了刀梯大会考。,+
1464,她们或多或少没举办刀梯大会考。,-
1465,她们或多或少减少了温室气体排放。,+
1466,她们或多或少没减少温室气体排放。,-
1467,她们或多或少发动了军事政变。,+
1468,她们或多或少没发动军事政变。,-
1469,她们或多或少问问了他意见。,+
1470,她们或多或少没问问他意见。,-
1471,她们或多或少拿了两届冠军。,+
1472,她们或多或少没拿两届冠军。,-
1473,他们或多或少确保了证书使用安全。,+
1474,他们或多或少没确保证书使用安全。,-
1475,他们或多或少等了你消息。,+
1476,他们或多或少没等你消息。,-
1477,他们或多或少像了水龙头。,+
1478,他们或多或少没像水龙头。,-
1479,她们或多或少限制了抗议示威者。,+
1480,她们或多或少没限制抗议示威者。,-
1481,她们或多或少撞进了火里。,+
1482,她们或多或少没撞进火里。,-
1483,他们或多或少搜搜了小孩书包。,+
1484,他们或多或少没搜搜小孩书包。,-
1485,她们或多或少拓展了生产力布局。,+
1486,她们或多或少没拓展生产力布局。,-
1487,他们或多或少调集了人力。,+
1488,他们或多或少没调集人力。,-
1489,她们或多或少购买了住房。,+
1490,她们或多或少没购买住房。,-
1491,她们或多或少追查了其他嫌犯。,+
1492,她们或多或少没追查其他嫌犯。,-
1493,她们或多或少赔了他3万元。,+
1494,她们或多或少没赔他3万元。,-
1495,她们或多或少阅读了一篇文章。,+
1496,她们或多或少没阅读一篇文章。,-
1497,他们或多或少远走了他国。,+
1498,他们或多或少没远走他国。,-
1499,他们或多或少辨别了他们。,+
1500,他们或多或少没辨别他们。,-
1501,她们或多或少讲了闽南话。,+
1502,她们或多或少没讲闽南话。,-
1503,她们或多或少允许了民主。,+
1504,她们或多或少没允许民主。,-
1505,她们或多或少做成了标签。,+
1506,她们或多或少没做成标签。,-
1507,她们或多或少寄予了希望。,+
1508,她们或多或少没寄予希望。,-
1509,他们或多或少讨好了西方。,+
1510,他们或多或少没讨好西方。,-
1511,他们或多或少专司了招财。,+
1512,他们或多或少没专司招财。,-
1513,她们或多或少注重了打扮。,+
1514,她们或多或少没注重打扮。,-
1515,她们或多或少依赖了宗教。,+
1516,她们或多或少没依赖宗教。,-
1517,她们或多或少解决了教师工职问题。,+
1518,她们或多或少没解决教师工职问题。,-
1519,他们或多或少喜庆了羊年春节。,+
1520,他们或多或少没喜庆羊年春节。,-
1521,她们或多或少进展成了步打球。,+
1522,她们或多或少没进展成步打球。,-
1523,她们或多或少加上了花朵。,+
1524,她们或多或少没加上花朵。,-
1525,他们或多或少管好了教会。,+
1526,他们或多或少没管好教会。,-
1527,她们或多或少借了高利贷。,+
1528,她们或多或少没借高利贷。,-
1529,她们或多或少投资了重大交通建设。,+
1530,她们或多或少没投资重大交通建设。,-
1531,他们或多或少缺少了经费。,+
1532,他们或多或少没缺少经费。,-
1533,他们或多或少建议了十一。,+
1534,他们或多或少没建议十一。,-
1535,她们或多或少筹措了资金。,+
1536,她们或多或少没筹措资金。,-
1537,他们或多或少消除了恐慌。,+
1538,他们或多或少没消除恐慌。,-
1539,他们或多或少临摹了诸多名家书帖。,+
1540,他们或多或少没临摹诸多名家书帖。,-
1541,她们或多或少上了暑期班。,+
1542,她们或多或少没上暑期班。,-
1543,他们或多或少加快了发展。,+
1544,他们或多或少没加快发展。,-
1545,她们或多或少看待了雾社事件。,+
1546,她们或多或少没看待雾社事件。,-
1547,她们或多或少解决了南海问题。,+
1548,她们或多或少没解决南海问题。,-
1549,她们或多或少问问了具体时间等。,+
1550,她们或多或少没问问具体时间等。,-
1551,他们或多或少看了西游记。,+
1552,他们或多或少没看西游记。,-
1553,她们或多或少熟悉了megabus。,+
1554,她们或多或少没熟悉megabus。,-
1555,她们或多或少扣去了腐败违法因素。,+
1556,她们或多或少没扣去腐败违法因素。,-
1557,她们或多或少进行了抗议。,+
1558,她们或多或少没进行抗议。,-
1559,他们或多或少加快了市场立法步伐。,+
1560,他们或多或少没加快市场立法步伐。,-
1561,他们或多或少寻找了利基。,+
1562,他们或多或少没寻找利基。,-
1563,他们或多或少担当了军委主席。,+
1564,他们或多或少没担当军委主席。,-
1565,她们或多或少传染上了多少陈年细菌。,+
1566,她们或多或少没传染上多少陈年细菌。,-
1567,她们或多或少转换了经营机制。,+
1568,她们或多或少没转换经营机制。,-
1569,他们或多或少追究了刑事责任。,+
1570,他们或多或少没追究刑事责任。,-
1571,他们或多或少举了一个小例子。,+
1572,他们或多或少没举一个小例子。,-
1573,她们或多或少象了国内设计院。,+
1574,她们或多或少没象国内设计院。,-
1575,他们或多或少进入了敌阵地。,+
1576,他们或多或少没进入敌阵地。,-
1577,她们或多或少缺少了经济适用住房。,+
1578,她们或多或少没缺少经济适用住房。,-
1579,他们或多或少修正了错误。,+
1580,他们或多或少没修正错误。,-
1581,她们或多或少符合了规则程序。,+
1582,她们或多或少没符合规则程序。,-
1583,他们或多或少表达了善意。,+
1584,他们或多或少没表达善意。,-
1585,她们或多或少爱护了一般干部职工。,+
1586,她们或多或少没爱护一般干部职工。,-
1587,她们或多或少发布了公报。,+
1588,她们或多或少没发布公报。,-
1589,他们或多或少陷入了危急。,+
1590,他们或多或少没陷入危急。,-
1591,她们或多或少关入了劳改营。,+
1592,她们或多或少没关入劳改营。,-
1593,她们或多或少提高了环境质量。,+
1594,她们或多或少没提高环境质量。,-
1595,他们或多或少寻找了依据。,+
1596,他们或多或少没寻找依据。,-
1597,她们或多或少讨回了万亿借债。,+
1598,她们或多或少没讨回万亿借债。,-
1599,他们或多或少透露了军情。,+
1600,他们或多或少没透露军情。,-
1601,她们或多或少领取了救济金。,+
1602,她们或多或少没领取救济金。,-
1603,她们或多或少参与了建设。,+
1604,她们或多或少没参与建设。,-
1605,他们或多或少节约了空地和农场。,+
1606,他们或多或少没节约空地和农场。,-
1607,他们或多或少进军了国际。,+
1608,他们或多或少没进军国际。,-
1609,她们或多或少夹起了尾巴。,+
1610,她们或多或少没夹起尾巴。,-
1611,她们或多或少给予了一些小国家机会。,+
1612,她们或多或少没给予一些小国家机会。,-
1613,他们或多或少关照了我们。,+
1614,他们或多或少没关照我们。,-
1615,她们或多或少生产了锅碗瓢盆。,+
1616,她们或多或少没生产锅碗瓢盆。,-
1617,他们或多或少摊开了数据。,+
1618,他们或多或少没摊开数据。,-
1619,他们或多或少迈向了统一。,+
1620,他们或多或少没迈向统一。,-
1621,他们或多或少引爆了瓦斯。,+
1622,他们或多或少没引爆瓦斯。,-
1623,她们或多或少享受了医保。,+
1624,她们或多或少没享受医保。,-
